avatar,country,countryCode,date,isVerified,position,productAsin,ratingScore,reviewDescription,reviewImages/0,reviewImages/1,reviewImages/2,reviewImages/3,reviewImages/4,reviewImages/5,reviewImages/6,reviewImages/7,reviewImages/8,reviewReaction,reviewTitle,reviewUrl,reviewedIn,username,variant
https://images-na.ssl-images-amazon.com/images/G/01/x-locale/common/grey-pixel.gif,United States,,2018-12-17,TRUE,4,B077869S2X,5,"What a great surprise. My husband and I were floored when we saw it. It looks gorgeous and very real. If I had known I would never have spent so much on my other diamonds. Crazy.This is exactly like the twelve thousand dollar one my daughter is wearing. Except this one is bigger and a heck of a lot cheaper. I feel so great wearing it.The band is thin (come with a band), so I ordered a wider one which I haven't received yet. I'm sure it will be wonderful.Everyone gives me compliments. No one has ever questioned it. Our adult daughters think Dad is so wonderful buying Mom such an expensive diamond. No one will be the wiser. I'm even starting to believe its real.It is incredible. Love Love Love!!!",https://images-na.ssl-images-amazon.com/images/I/61+8MK3nNHL._SY88.jpg,https://images-na.ssl-images-amazon.com/images/I/61+8MK3nNHL._SY88.jpg,https://images-na.ssl-images-amazon.com/images/I/617QVBY1-GL._SY88.jpg,,,,,,,31 people found this helpful,I cannot believe how real this looks. Beautiful!,https://www.amazon.com/gp/customer-reviews/R2WZ4VS3RQNBX8/ref=cm_cr_arp_d_rvw_ttl?ie=UTF8&ASIN=B09PZKVF3Z,"Reviewed in the United States on December 17, 2018",Carla O'BrienCarla O'Brien,Ring Size: 6Total Diamond Weight: 1.5 carats
https://images-na.ssl-images-amazon.com/images/G/01/x-locale/common/grey-pixel.gif,United States,,2019-04-24,TRUE,5,B077869S2X,5,"This is so beautiful! I definitely have to tell all of you that it runs big. I’m always a size 7 (ring finger) and these rings fall to the side. I either have to get something that makes it snug, or I’ll have to return it for a 6. We’ll see. I’m very happy with this purchase. I included a video to show you pretty it sparkles.UPDATE: After a while (couple months?) the “diamond” becomes very dull/cloudy. Does not sparkle anywhere near like it did when I received it. That’s depressing. On the bright side, it hasn’t turned my finger green. I would not purchase again.",https://images-na.ssl-images-amazon.com/images/I/61iCEpfpTDL._SY88.jpg,https://images-na.ssl-images-amazon.com/images/I/71WxS3roY0L._SY88.jpg,https://images-na.ssl-images-amazon.com/images/I/71mGd3Fj1QL._SY88.jpg,https://images-na.ssl-images-amazon.com/images/I/71uRky20f7L._SY88.jpg,,,,,,24 people found this helpful,"Beautiful, but size runs big/UPDATE.",https://www.amazon.com/gp/customer-reviews/R2THUZBV4F3QNP/ref=cm_cr_arp_d_rvw_ttl?ie=UTF8&ASIN=B09PZKVF3Z,"Reviewed in the United States on April 24, 2019",AmyAmy,Ring Size: 7Total Diamond Weight: 1.5 carats
https://images-na.ssl-images-amazon.com/images/G/01/x-locale/common/grey-pixel.gif,United States,,2019-10-07,TRUE,6,B077869S2X,3,"I was very impressed by the ring when it arrived. It appears real from a distance and is as pictured. Unfortunately, in just over a month the ring’s silver playing is beginning to peel off. This is disappointing that in such a short amount of time the ring is already breaking. I have made sure to take good care of it- taking it off to shower and workout.",https://images-na.ssl-images-amazon.com/images/I/611I0hpIa6L._SY88.jpg,https://images-na.ssl-images-amazon.com/images/I/61KV0TSk-PL._SY88.jpg,https://images-na.ssl-images-amazon.com/images/I/71YeFjzusSL._SY88.jpg,,,,,,,2 people found this helpful,Beautiful but poor quality,https://www.amazon.com/gp/customer-reviews/R3P0A2BHNNELZZ/ref=cm_cr_arp_d_rvw_ttl?ie=UTF8&ASIN=B09PZKVF3Z,"Reviewed in the United States on October 7, 2019",NicoleNicole,Ring Size: 5Total Diamond Weight: 1.5 carats
https://images-na.ssl-images-amazon.com/images/G/01/x-locale/common/grey-pixel.gif,United States,,2021-02-18,TRUE,7,B077869S2X,5,This ring is legit for everyday wear. My diamond was about to fall out so I crossed my fingers and ordered and I'm so thankful I did. I used to wear my ring every day but now I think I'm just going to wear this more often and take better care of my diamond!,,,,,,,,,,,perfect sub,https://www.amazon.com/gp/customer-reviews/R3D1PL50ZMT5LI/ref=cm_cr_arp_d_rvw_ttl?ie=UTF8&ASIN=B09PZKVF3Z,"Reviewed in the United States on February 18, 2021",Erin,Ring Size: 6Total Diamond Weight: 1.5 carats
https://images-na.ssl-images-amazon.com/images/G/01/x-locale/common/grey-pixel.gif,United States,,2022-04-06,TRUE,8,B077869S2X,5,"Like that in looks believable, beautiful ring for the price.",,,,,,,,,,,A lot of sparkle for the money.,https://www.amazon.com/gp/customer-reviews/R2VWL9DKW4OBO8/ref=cm_cr_arp_d_rvw_ttl?ie=UTF8&ASIN=B09PZKVF3Z,"Reviewed in the United States on April 6, 2022",Martingilhooly,Ring Size: 8Total Diamond Weight: 1.5 carats
https://images-na.ssl-images-amazon.com/images/G/01/x-locale/common/grey-pixel.gif,United States,,2019-08-09,TRUE,9,B077869S2X,3,"I disagree with the reviews saying it runs large. I very much know my ring size. It sparkles a lot, yes, but I got the 1.5, and it was too large to be believable, especially compared to my real ring. Would be great for someone whose real ring is massive and very expensive.",,,,,,,,,,,Runs true to size but not believable,https://www.amazon.com/gp/customer-reviews/R234SW05QH8D99/ref=cm_cr_arp_d_rvw_ttl?ie=UTF8&ASIN=B09PZKVF3Z,"Reviewed in the United States on August 9, 2019",Ktipps,Ring Size: 5.5Total Diamond Weight: 1.5 carats
https://images-na.ssl-images-amazon.com/images/G/01/x-locale/common/grey-pixel.gif,United States,,2021-01-31,TRUE,10,B077869S2X,5,I loved this ring when I first bought it. But then the diamond lost its sparkle. I ordered another one hoping it will keep its sparkle. Will review in a fewmonths with an up date.,,,,,,,,,,One person found this helpful,Princess cut 1ct,https://www.amazon.com/gp/customer-reviews/R2IQP8QMZKFPCO/ref=cm_cr_arp_d_rvw_ttl?ie=UTF8&ASIN=B09PZKVF3Z,"Reviewed in the United States on January 31, 2021",Diane smith,Ring Size: 7Total Diamond Weight: 1.5 carats
https://images-na.ssl-images-amazon.com/images/G/01/x-locale/common/grey-pixel.gif,United States,,2023-04-16,TRUE,1,B07CBWWB6R,5,"It is beautiful. Very pretty, better than expected.",,,,,,,,,,,Fantastic,https://www.amazon.com/gp/customer-reviews/RPI605A6CAFG/ref=cm_cr_arp_d_rvw_ttl?ie=UTF8&ASIN=B0BRSQQ7YL,"Reviewed in the United States on April 16, 2023",Amazon Customer,Ring Size: 7
https://images-na.ssl-images-amazon.com/images/G/01/x-locale/common/grey-pixel.gif,United States,,2023-02-06,TRUE,2,B07CBWWB6R,5,"This ring is absolutely beautiful. Looks more expensive than it is. Order your normal size. I order a little larger than what I wear and it is no big. Have to return for the correct size. Even though it is a larger ring, it is comfortable on. Love it.",https://m.media-amazon.com/images/I/31vUaqcZI7L._SY88.jpg,,,,,,,,,,Beautiful Ring,https://www.amazon.com/gp/customer-reviews/RF173ASTL7CBX/ref=cm_cr_arp_d_rvw_ttl?ie=UTF8&ASIN=B0BRSQQ7YL,"Reviewed in the United States on February 6, 2023",Bonnie SableBonnie Sable,Ring Size: 8
https://images-na.ssl-images-amazon.com/images/G/01/x-locale/common/grey-pixel.gif,United States,,2022-12-14,TRUE,3,B07CBWWB6R,5,"I just received this ring from my husband for my birthday gift. We were both skeptical but decided to go ahead and order. Much to our surprise, we are both extremely happy! This ring is absolutely gorgeous! It has sparkle and shine! A home run in our books. So happy we decided on this purchase.",,,,,,,,,,3 people found this helpful,Gorgeous!,https://www.amazon.com/gp/customer-reviews/R1H7EM4PCXBYTD/ref=cm_cr_arp_d_rvw_ttl?ie=UTF8&ASIN=B0BRSQQ7YL,"Reviewed in the United States on December 14, 2022",Amazon Customer,Ring Size: 9
https://images-na.ssl-images-amazon.com/images/G/01/x-locale/common/grey-pixel.gif,United States,,2022-12-07,TRUE,4,B07CBWWB6R,5,"The ring is gorgeous --I picked it for my 25th wedding anniversary present. The stones are set a bit higher so it doesn't really rub against the middle and pinky fingers. Good value too for a total 1 carat weight.Looked at Zales , had double the price for a lot less carat weight.",,,,,,,,,,4 people found this helpful,Beautiful and sparkly!,https://www.amazon.com/gp/customer-reviews/R2037CF0H4526V/ref=cm_cr_arp_d_rvw_ttl?ie=UTF8&ASIN=B0BRSQQ7YL,"Reviewed in the United States on December 7, 2022",Lynne,Ring Size: 8
https://images-na.ssl-images-amazon.com/images/G/01/x-locale/common/grey-pixel.gif,United States,,2022-12-31,TRUE,5,B07CBWWB6R,5,"This ring is gorgeous, very sparkly and beautiful to look at.",,,,,,,,,,,Beautiful,https://www.amazon.com/gp/customer-reviews/RHROSD3YVY7UE/ref=cm_cr_arp_d_rvw_ttl?ie=UTF8&ASIN=B0BRSQQ7YL,"Reviewed in the United States on December 31, 2022",Amazon Customer,Ring Size: 8
https://images-na.ssl-images-amazon.com/images/G/01/x-locale/common/grey-pixel.gif,United States,,2021-03-22,TRUE,6,B07CBWWB6R,4,"My husband bought this ring for me to wear occasionally in place of my wedding set. I was quite surprised at the beauty of this ring. I personally think it looks better than the photos supplied by the seller. After looking at it closer, some of the round stones have scratches on them. The baguette stones look good though. Unfortunately, I have to return it because it's too small to fit over my knuckle (I was able to fit it over my knuckle later in the day, but it was not comfortable to do so). I did contact the seller and was able to order it directly from them in a half size bigger, so I'm hoping that one is just as sparkly looking.",https://images-na.ssl-images-amazon.com/images/I/618rvZk--RL._SY88.jpg,https://images-na.ssl-images-amazon.com/images/I/71WwftXcJOL._SY88.jpg,https://images-na.ssl-images-amazon.com/images/I/71YF0kKU6mL._SY88.jpg,https://images-na.ssl-images-amazon.com/images/I/71YFQVj+ZcL._SY88.jpg,https://images-na.ssl-images-amazon.com/images/I/71bs4hmzk9L._SY88.jpg,https://images-na.ssl-images-amazon.com/images/I/71zBxABwoeL._SY88.jpg,,,,16 people found this helpful,"Don't hesitate, it's beautiful!",https://www.amazon.com/gp/customer-reviews/RSXGN2OTOIRAP/ref=cm_cr_arp_d_rvw_ttl?ie=UTF8&ASIN=B0BRSQQ7YL,"Reviewed in the United States on March 22, 2021",BeckyBecky,Ring Size: 6
https://images-na.ssl-images-amazon.com/images/G/01/x-locale/common/grey-pixel.gif,United States,,2021-06-02,TRUE,7,B07CBWWB6R,5,"I have spent well over 6 months trying to find the perfect ring after I lost my original diamond from my wedding set. Trust me when I say, I KNOW about diamonds. I was prepared to spend thousands of dollars until I found this ring. I love the smaller diamonds with such HUGE sparkle. I have bigger hands (wear a size 9) and it fits perfectly. The outside diamonds are a pinch cloudy but still have a nice sparkle. The Baguettes are so clear and sparkly it covers for the less sparkly ones.It truly is a beautiful ring. I am so pleased and happy. I relied on reviews, videos, and photos so I wanted to add mine as well.",https://images-na.ssl-images-amazon.com/images/I/A1xSCBi9e-L._SY88.jpg,,,,,,,,,37 people found this helpful,Beautiful!!!,https://www.amazon.com/gp/customer-reviews/R3T9DMYMS530BM/ref=cm_cr_arp_d_rvw_ttl?ie=UTF8&ASIN=B0BRSQQ7YL,"Reviewed in the United States on June 2, 2021",Abbie J.Abbie J.,Ring Size: 9
https://images-na.ssl-images-amazon.com/images/G/01/x-locale/common/grey-pixel.gif,United States,,2022-08-06,TRUE,8,B07CBWWB6R,5,I was more than excited when I got this delivered and I opened the box. Beautiful diamonds and classy. Best purchase and the quality won't disappoint,,,,,,,,,,,Absolutely gorgeous.,https://www.amazon.com/gp/customer-reviews/R2TB01A55SCZUY/ref=cm_cr_arp_d_rvw_ttl?ie=UTF8&ASIN=B0BRSQQ7YL,"Reviewed in the United States on August 6, 2022",Kerry,Ring Size: 10
https://images-na.ssl-images-amazon.com/images/G/01/x-locale/common/grey-pixel.gif,United States,,2022-10-08,TRUE,9,B07CBWWB6R,5,Excellent quality item.,,,,,,,,,,One person found this helpful,The ring exceeded my expectations. It is more beautiful that the photo or video.,https://www.amazon.com/gp/customer-reviews/R2KTLNA1Y4V20R/ref=cm_cr_arp_d_rvw_ttl?ie=UTF8&ASIN=B0BRSQQ7YL,"Reviewed in the United States on October 8, 2022",Lorie Floyd,Ring Size: 7
https://images-na.ssl-images-amazon.com/images/G/01/x-locale/common/grey-pixel.gif,United States,,2022-08-11,TRUE,10,B07CBWWB6R,5,I love this gorgeous ring! I got it for our 40th wedding anniversary and couldn't be happier!!!,,,,,,,,,,,Gorgeous ring!!,https://www.amazon.com/gp/customer-reviews/R200RXVCL5LQBF/ref=cm_cr_arp_d_rvw_ttl?ie=UTF8&ASIN=B0BRSQQ7YL,"Reviewed in the United States on August 11, 2022",Kathy H,Ring Size: 9
https://images-na.ssl-images-amazon.com/images/G/01/x-locale/common/grey-pixel.gif,United States,,2020-10-24,TRUE,1,B01LMXKMNI,4,"I really love this ring. It is seriously prettier than some diamond rings I've seen. I have a two ct round solitaire ring that's diamond and I think I like this one more than it. Shhhh! Just don't tell my husband . I baked it like some others have done and I will probably bake it one more time. But it is beautiful as is right out of the box , you don't need to bake it. I thought it would be too gaudy. This isn't usually my style. The ct is huge. The only reason I give four stars instead of five is because it arrived scuffed on the back and I wear a five and I find it's a little too small. I can still wear it but it's hard getting on and off. I will order a six in near future. This will be my stand in and I will update as time goes on. It's real sterling silver and is stamped. Others have asked about it so I will be the one to verify. Def worth it. Pleassseee don't hesitate. I have been looking at this ring for three years and I am so happy I have finally bought it. It was SO WORTH IT UPDATE!Its been a few months and it has def held up. i took a break from wearing it for a while bc i got a new diamond teardrop wedding set. But I still switch it up and wear this one. No one can tell the difference and i am constantly getting compliments. i do recommend a size up though if youre inbetween sizes like i am. im a 5.25 and the 5 is really tight! other than that, no complaints!",https://images-na.ssl-images-amazon.com/images/I/612K2ZxkBXL._SY88.jpg,https://images-na.ssl-images-amazon.com/images/I/71Y6ztVvIOL._SY88.jpg,,,,,,,,3 people found this helpful,Seriously worth it!,https://www.amazon.com/gp/customer-reviews/R381I2CSW2GLG5/ref=cm_cr_arp_d_rvw_ttl?ie=UTF8&ASIN=B01G5H1992,"Reviewed in the United States on October 24, 2020",ANBCANBC,Metal Type: simulated diamond 10mmRing Size: 5
https://images-na.ssl-images-amazon.com/images/G/01/x-locale/common/grey-pixel.gif,United States,,2023-04-17,TRUE,2,B01LMXKMNI,5,I bought this ring about four years ago and I have been wearing it everyday.,https://m.media-amazon.com/images/I/616ylfOaKOL._SY88.jpg,,,,,,,,,,Using as a wedding ring,https://www.amazon.com/gp/customer-reviews/R32SIRV20CAYKL/ref=cm_cr_arp_d_rvw_ttl?ie=UTF8&ASIN=B01G5H1992,"Reviewed in the United States on April 17, 2023",Eawham Eawham,Metal Type: simulated diamond 7mmRing Size: 7
https://images-na.ssl-images-amazon.com/images/G/01/x-locale/common/grey-pixel.gif,United States,,2017-04-20,TRUE,3,B01LMXKMNI,5,"This ring is beautiful! Shines great! It is large, very clear stine, looks like a diamond in color meaning it does not look like a piece of glass. It has facets in it and sparkles beautifully in sun and ambient lightening. It does not turn my finger green at all. I wore it for a week everyday, doing my normal days activities and it didn't effect it one bit. The sterling seems to be very plated on most likely has a rhodium flash on it. Anything plated without rhodium on me, turns my skin green. I have very high acid in my skin. This ring is great in every way, except the band is thin for a stone that size! I've bought a stainless steel wide band to pair with it! I know it's really going to make that ring pop! I bought an etched band and a wide plain band. Suppose to be here today. I will post a picture at that time with the band. It is true to size, does not spin on my finger. I. Clean it daily in the morning with a little dish soap and a soft tooth brush, rinse in warm water then cold and I dry and polish with an old cotton tee. It looks brand new Everytime. Do not use jewelry cleaner on any of this type jewelry!! It will RUIN your ring!! And it just never requires that type of cleaning. It will take the finish off your prongs even if the rest stays nice! Once my prongs turn brass, I pitch it! So many times even if the plating is solid and possibly rhodium flashed, often times the prongs are not! And a harsh chemical such as cleaners will take the plating right off those prongs! Just stick with soapy water and dry cotton cloth, it will be beautiful a very long time. I also have noticed with this type of cz it actually gains greater luster and shine over time for some reason. I've never had one to cloud on me with proper care. These type of cz have a certain look to them that you can spot in an actual photo of the ring after you've bought a few. It looks hard, it's clear, it's faceted, it reflects light similar to a diamond. However the 4 carat size makes other family and friends know it's fake. But if your a high society gal, that wants something to wear on vacation or when going out, and you generally wear big stones...Don't hesitate buy it, pair it with a beautiful band, a silver bracelet and off you go. Looks like a million bucks! Enjoy!",https://images-na.ssl-images-amazon.com/images/I/610XK+nrPML._SY88.jpg,https://images-na.ssl-images-amazon.com/images/I/716+RBhYk-L._SY88.jpg,https://images-na.ssl-images-amazon.com/images/I/71Mjx+WgVXL._SY88.jpg,,,,,,,34 people found this helpful,Big beautiful shine,https://www.amazon.com/gp/customer-reviews/R2CZMSB2C0WPZN/ref=cm_cr_arp_d_rvw_ttl?ie=UTF8&ASIN=B01G5H1992,"Reviewed in the United States on April 20, 2017",Deb H.Deb H.,Metal Type: simulated diamond 10mmRing Size: 6
https://images-na.ssl-images-amazon.com/images/G/01/x-locale/common/grey-pixel.gif,United States,,2022-01-27,TRUE,4,B01LMXKMNI,3,The basket is set unevenly and is too big/set too high for the stone inside of it. The stone itself looks ok but the culet isn’t cut well so it doesn’t sparkle the greatest for a CZ. The prongs also seem to catch on everything.I did not buy this for frequent wear. I only bought it to get a sense for what size and shape stone and what type of setting I will eventually want in an engagement ring so it doesn’t really matter to me but these issues would annoy the heck out of me if I was planning to wear it more than like a week or so out of my life.,,,,,,,,,,,Over all just meh,https://www.amazon.com/gp/customer-reviews/R1QVR9HAOQHAUA/ref=cm_cr_arp_d_rvw_ttl?ie=UTF8&ASIN=B01G5H1992,"Reviewed in the United States on January 27, 2022",Katherine Robertson,Metal Type: simulated diamond 10mmRing Size: 9
https://images-na.ssl-images-amazon.com/images/G/01/x-locale/common/grey-pixel.gif,United States,,2018-05-06,TRUE,5,B01LMXKMNI,5,"I ended up getting this based on the other reviews, which most were 5 stars and seem to rave about this ring. I thought, heck, why not give it a try since almost everyone else seems to love it. I do not know what I had in my mind, but for $19.88 (after taxes), this ring has far exceeded my expectations. My boyfriend and I were looking for a promise ring. I did not want him spending a ton of money on rings, so I decided to look at sites like Jeulia, Jewlr, etc. and then for fun, decided to see what Amazon had. I will be honest, before I bought this, the day before I had bought a Jeulia ($93 after taxes on their site) ring, sterling silver and simulated stone solitaire and 1 ""carat"" as well....impressed but this TenFit ring is preferred by me...and it was not even 20$!!!!...I cannot get over it! This ring shines like crazy, their sizing was true to size for me, and it's not a faux looking. If I was shown this ring, I would never have guess it's a simulated diamond (cubic zirconia). I have purchased CZ rings before, from Pandora, and even after a few days, the silver lost some of it's shine and so did the CZ. It became cloudy and just looked fake. Now, I really did not care what simulated stone I got, it just so happened that this one was CZ. Great quality, great price, and looks genuine. No problems at all yet, still looks brand new. Totally worth it if you're not looking to spend an arm and a leg. I plan on doing another updated review after a couple months but so far, one very surprised and pleased customer.Update 12/22/18: ring is still holding up beautifully and no issues. I expected scratching from everyday wear being sterling silver but sterliving silver Jewry wipes do the trick to bring back that shiny look. I’m in love with it still. Would definitely recommend still, can’t beat the price, even if it did go up a bit from when I purchased it in May.",https://images-na.ssl-images-amazon.com/images/I/7125CdjhELL._SY88.jpg,https://images-na.ssl-images-amazon.com/images/I/71DmxfMStKL._SY88.jpg,,,,,,,,33 people found this helpful,WOW x 100!!! Worth it!,https://www.amazon.com/gp/customer-reviews/R3PPGB2EYTQA75/ref=cm_cr_arp_d_rvw_ttl?ie=UTF8&ASIN=B01G5H1992,"Reviewed in the United States on May 6, 2018",Amazon CustomerAmazon Customer,Metal Type: simulated diamond 7mmRing Size: 6
https://images-na.ssl-images-amazon.com/images/G/01/x-locale/common/grey-pixel.gif,United States,,2022-07-20,TRUE,6,B01LMXKMNI,5,"Love this ring! I wanted to change up from my diamond set that I originally have, but I wanted to try some styles for awhile. I am using as a back up ring when I travel. It is what it is, but seriously the ring is very realistic. I did notice that I got a size nine and it is running big. If you want to have extra security, there is an insurance plan offered. I am glad to find a company where I can get a realistic ring for a low price. That way if anything happen to it you can replace it without issue. Get it, you will love it!",https://m.media-amazon.com/images/I/71GN4uYTZML._SY88.jpg,https://m.media-amazon.com/images/I/71Yyvkoyi6L._SY88.jpg,,,,,,,,,Love this ring!!,https://www.amazon.com/gp/customer-reviews/R1OQYKJ2EF54I7/ref=cm_cr_arp_d_rvw_ttl?ie=UTF8&ASIN=B01G5H1992,"Reviewed in the United States on July 20, 2022",a.Natasha B.a.Natasha B.,Metal Type: simulated diamond 10mmRing Size: 9
https://images-na.ssl-images-amazon.com/images/G/01/x-locale/common/grey-pixel.gif,United States,,2023-02-08,TRUE,7,B01LMXKMNI,2,"it's very nice but the size is very snug and wish they had sizes 10-12. you may need to get a size up with this ring, it comes in a box that could hardly fit the ring (another word the box is too small for the ring to fit), that's why I gave it a 2 star review",,,,,,,,,,,4 ct round cushion solitaire cut ring...,https://www.amazon.com/gp/customer-reviews/R34UUSXU93YT0E/ref=cm_cr_arp_d_rvw_ttl?ie=UTF8&ASIN=B01G5H1992,"Reviewed in the United States on February 8, 2023",M M,Metal Type: simulated diamond 10mmRing Size: 9
https://images-na.ssl-images-amazon.com/images/G/01/x-locale/common/grey-pixel.gif,United States,,2022-10-26,TRUE,8,B01LMXKMNI,5,"I bought this for a Breakfast at Tiffany's Bridal Shower getup - added the black Satin Gloves - PERFECT - Sparkles, Big and fits perfectly - had to order a size larger to fit over the glove but couldn't be more happy with the outcome. I wouldn't wear this as an every day wearer - doesn't look that real but it does look really good",,,,,,,,,,,Shines,https://www.amazon.com/gp/customer-reviews/R2EIZ785ZZJMVY/ref=cm_cr_arp_d_rvw_ttl?ie=UTF8&ASIN=B01G5H1992,"Reviewed in the United States on October 26, 2022",Bonnie,Metal Type: simulated diamond 10mmRing Size: 7
https://images-na.ssl-images-amazon.com/images/G/01/x-locale/common/grey-pixel.gif,United States,,2023-01-14,TRUE,9,B01LMXKMNI,5,But it's a beautiful ring 6 stars,,,,,,,,,,,Arrived late,https://www.amazon.com/gp/customer-reviews/R3UJYECIOV1Z67/ref=cm_cr_arp_d_rvw_ttl?ie=UTF8&ASIN=B01G5H1992,"Reviewed in the United States on January 14, 2023",Raziel,Metal Type: simulated diamond 10mmRing Size: 6
