avatar,country,countryCode,date,isVerified,position,productAsin,ratingScore,reviewDescription,reviewImages/0,reviewImages/1,reviewImages/2,reviewImages/3,reviewImages/4,reviewImages/5,reviewImages/6,reviewImages/7,reviewImages/8,reviewReaction,reviewTitle,reviewUrl,reviewedIn,username,variant
https://images-na.ssl-images-amazon.com/images/G/01/x-locale/common/grey-pixel.gif,United States,,2018-08-31,TRUE,4,B01FLM2B6W,4,"If you're looking for top graded (color/clarity) diamonds, this isn't your ring. One nationwide, mid-level department store sells this exact ring for $6,195.00 regular price, with an average sale price of $1,700.00, not including additional discounts. All diamonds are very securely set. There's a significant amount of rhodium plated white gold in this hefty ring. It is sizable by a reputable jeweler; if you have it sized, rhodium plating at the shank will cost a bit more, but isn't strictly necessary. When Amazon dropped its price to a small fraction of regular retail, I placed an order. The diamonds in my ring are approximately one grade above the color and clarity listed on the web page description. Not all will be that way, but Amazon has free returns if you aren't happy. Special thanks to the reviewer who provided a real life picture!",,,,,,,,,,20 people found this helpful,Beautiful Bling on a Budget,https://www.amazon.com/gp/customer-reviews/R1FZVV8PLWIGMR/ref=cm_cr_arp_d_rvw_ttl?ie=UTF8&ASIN=B09BZQGL8D,"Reviewed in the United States on August 31, 2018",E. M. Griffith,Ring Size: 7
https://images-na.ssl-images-amazon.com/images/G/01/x-locale/common/grey-pixel.gif,United States,,2022-03-19,TRUE,5,B01FLM2B6W,5,"Nice looking ring, is bigger than it looks in the pics. Pleased overall",https://m.media-amazon.com/images/I/61X3b86S4xL._SY88.jpg,,,,,,,,,2 people found this helpful,Love it,https://www.amazon.com/gp/customer-reviews/RGOCT1FLI1RW8/ref=cm_cr_arp_d_rvw_ttl?ie=UTF8&ASIN=B09BZQGL8D,"Reviewed in the United States on March 19, 2022",imaniimani,Ring Size: 7
https://images-na.ssl-images-amazon.com/images/G/01/x-locale/common/grey-pixel.gif,United States,,2022-05-05,TRUE,6,B01FLM2B6W,5,I LOVE IT!,https://m.media-amazon.com/images/I/617EqOcszAL._SY88.jpg,,,,,,,,,6 people found this helpful,This is a gorgeous ring!,https://www.amazon.com/gp/customer-reviews/R1YP0ANXW47CCU/ref=cm_cr_arp_d_rvw_ttl?ie=UTF8&ASIN=B09BZQGL8D,"Reviewed in the United States on May 5, 2022",SUSAN WHETZELSUSAN WHETZEL,Ring Size: 8
https://images-na.ssl-images-amazon.com/images/G/01/x-locale/common/grey-pixel.gif,United States,,2017-09-18,TRUE,7,B01FLM2B6W,5,"I love my ring!! I was concerned the photo made it look larger than the stones would actually be (especially for the price). But when I got it, it was VERY flashy and shiny/sparkly (can't miss it, basically). I asked my mother ""It's almost TOO flashy!"". I took it to a jeweler and they checked out the stones and the band - everything was legit. Can't be too careful :) So, if that's a concern, as it was for me, it's real. Not the highest quality, but for me: I can't tell a difference between this and someone's $10,000 ring (which is crazy, is my opinion).",,,,,,,,,,21 people found this helpful,I love my ring,https://www.amazon.com/gp/customer-reviews/R1KV4C4W7ZML1B/ref=cm_cr_arp_d_rvw_ttl?ie=UTF8&ASIN=B09BZQGL8D,"Reviewed in the United States on September 18, 2017",Erin S.,Ring Size: 7
https://images-na.ssl-images-amazon.com/images/G/01/x-locale/common/grey-pixel.gif,United States,,2021-12-01,TRUE,8,B01FLM2B6W,5,Love the quality and clarity of the diamonds. Shipped fast and received early. Definitely would buy from them again.,,,,,,,,,,4 people found this helpful,Absolutely beautiful ring!,https://www.amazon.com/gp/customer-reviews/ROPMVQOOEDHKK/ref=cm_cr_arp_d_rvw_ttl?ie=UTF8&ASIN=B09BZQGL8D,"Reviewed in the United States on December 1, 2021",Susan Pena,Ring Size: 7
https://images-na.ssl-images-amazon.com/images/G/01/x-locale/common/grey-pixel.gif,United States,,2021-04-09,TRUE,9,B01FLM2B6W,4,Was not disappointed. Great ring!!!,,,,,,,,,,3 people found this helpful,She said yes,https://www.amazon.com/gp/customer-reviews/RDR36S0TOS7SH/ref=cm_cr_arp_d_rvw_ttl?ie=UTF8&ASIN=B09BZQGL8D,"Reviewed in the United States on April 9, 2021",Steve Farabee,Ring Size: 7
https://images-na.ssl-images-amazon.com/images/G/01/x-locale/common/grey-pixel.gif,United States,,2021-09-02,TRUE,10,B01FLM2B6W,5,It has a lot of sparkle,,,,,,,,,,2 people found this helpful,This is a nice ring,https://www.amazon.com/gp/customer-reviews/R3VFA0TJP487WZ/ref=cm_cr_arp_d_rvw_ttl?ie=UTF8&ASIN=B09BZQGL8D,"Reviewed in the United States on September 2, 2021",Rosalind Grant,Ring Size: 8
https://images-na.ssl-images-amazon.com/images/G/01/x-locale/common/grey-pixel.gif,United States,,2023-05-05,TRUE,1,B0BG49JJ31,5,"Gorgeous ring, and even 2 months later it's shining and brilliant. No issues with loose stones. Very light scratches on the ring, but that's because I'm not the most cautious with it.",https://m.media-amazon.com/images/I/61U6BGilVXL._SY88.jpg,,,,,,,,,,Lots of compliments,https://www.amazon.com/gp/customer-reviews/R9KISIBRE0SWU/ref=cm_cr_arp_d_rvw_ttl?ie=UTF8&ASIN=B0BY9625NH,"Reviewed in the United States on May 5, 2023",JayceJayce,Color: SilverRing Size: 9.5
https://images-na.ssl-images-amazon.com/images/G/01/x-locale/common/grey-pixel.gif,United States,,2023-04-21,TRUE,2,B0BG49JJ31,4,"Very very pretty ring. Though, within a week whether from dropping it on my bathroom floor or just dinging it against something, one of the side diamonds fell out.",,,,,,,,,,One person found this helpful,Pretty sparkly diamond ring,https://www.amazon.com/gp/customer-reviews/R1RJDUQRX86SKU/ref=cm_cr_arp_d_rvw_ttl?ie=UTF8&ASIN=B0BY9625NH,"Reviewed in the United States on April 21, 2023",Emily Noelle,Color: SilverRing Size: 6
https://images-na.ssl-images-amazon.com/images/G/01/x-locale/common/grey-pixel.gif,United States,,2023-04-30,TRUE,3,B0BG49JJ31,5,Was on time and was very well made and packaged,,,,,,,,,,,It fit perfectly,https://www.amazon.com/gp/customer-reviews/R17E27FN3W2ISI/ref=cm_cr_arp_d_rvw_ttl?ie=UTF8&ASIN=B0BY9625NH,"Reviewed in the United States on April 30, 2023",Toby F.,Color: Silver-CustomizedRing Size: 7.5
https://images-na.ssl-images-amazon.com/images/G/01/x-locale/common/grey-pixel.gif,United States,,2023-02-01,TRUE,4,B0BG49JJ31,5,This was the perfect ring to give to my girlfriend as a promise ring. She loves it. The moissinite gem looks exactly like a good quality diamond. It sparkles and has gotten many compliments. I catch my girl staring at it regularly. And that is the goal right? For a fraction of the cost,,,,,,,,,,9 people found this helpful,Girlfriend loves it,https://www.amazon.com/gp/customer-reviews/R3N2QBAY8ZOITJ/ref=cm_cr_arp_d_rvw_ttl?ie=UTF8&ASIN=B0BY9625NH,"Reviewed in the United States on February 1, 2023",Sean Taylor,Color: SilverRing Size: 7
https://images-na.ssl-images-amazon.com/images/G/01/x-locale/common/grey-pixel.gif,United States,,2023-03-07,TRUE,5,B0BG49JJ31,5,Liked the ring very good quality,,,,,,,,,,,Very good,https://www.amazon.com/gp/customer-reviews/RVG6SAOGMUONK/ref=cm_cr_arp_d_rvw_ttl?ie=UTF8&ASIN=B0BY9625NH,"Reviewed in the United States on March 7, 2023",Wellsfargo,Color: RoseRing Size: 8
https://images-na.ssl-images-amazon.com/images/G/01/x-locale/common/grey-pixel.gif,United States,,2023-02-09,TRUE,6,B0BG49JJ31,5,"It looks amazing, totally catches the light. This was a great gift for the buy.",,,,,,,,,,One person found this helpful,Looks Amazing,https://www.amazon.com/gp/customer-reviews/R3O2TTNHQKHDYX/ref=cm_cr_arp_d_rvw_ttl?ie=UTF8&ASIN=B0BY9625NH,"Reviewed in the United States on February 9, 2023",Amazon Customer,Color: Rose-CustomizedRing Size: 9
https://images-na.ssl-images-amazon.com/images/G/01/x-locale/common/grey-pixel.gif,United States,,2023-01-25,TRUE,7,B0BG49JJ31,3,Not big enough,,,,,,,,,,2 people found this helpful,Dainty but beautiful,https://www.amazon.com/gp/customer-reviews/R399XJ1LHNFCSL/ref=cm_cr_arp_d_rvw_ttl?ie=UTF8&ASIN=B0BY9625NH,"Reviewed in the United States on January 25, 2023",jimmie carroll Herrera,Color: RoseRing Size: 8.5
https://images-na.ssl-images-amazon.com/images/G/01/x-locale/common/grey-pixel.gif,United States,,2023-01-05,TRUE,8,B0BG49JJ31,5,The packaging was great. Came fast And beautiful ring,,,,,,,,,,,Very beautiful ring,https://www.amazon.com/gp/customer-reviews/R7UWXBK2O4WDY/ref=cm_cr_arp_d_rvw_ttl?ie=UTF8&ASIN=B0BY9625NH,"Reviewed in the United States on January 5, 2023",Paul webb,Color: SilverRing Size: 8.5
https://images-na.ssl-images-amazon.com/images/G/01/x-locale/common/grey-pixel.gif,United States,,2023-05-22,TRUE,9,B0BG49JJ31,1,I sent this ring back two weeks ago and still have yet to receive a refund. It was too large and I can repurchase using the coupon bc I already used it once. This has been the worst most horrible return process I’ve experienced with Amazon. Please return my money so I can reorder proper size. Thanks.,,,,,,,,,,,Beautiful ring horrible return service,https://www.amazon.com/gp/customer-reviews/RPBI3XQVCUUO6/ref=cm_cr_arp_d_rvw_ttl?ie=UTF8&ASIN=B0BY9625NH,"Reviewed in the United States on May 22, 2023",New Yorker,Color: SilverRing Size: 8.5
https://images-na.ssl-images-amazon.com/images/G/01/x-locale/common/grey-pixel.gif,United States,,2023-05-18,TRUE,10,B0BG49JJ31,1,I took a chance and ordered this ring. I received it on May 5th. Tomorrow will make two weeks I have worn this ring and already it has tarnishing. The color is fading fairly quickly. I am highly disappointed for the hundred dollars I paid for this. Would not recommend.,https://m.media-amazon.com/images/I/41rTagk6i6L._SY88.jpg,https://m.media-amazon.com/images/I/61IPUvn4N4L._SY88.jpg,https://m.media-amazon.com/images/I/61JJV7r19lL._SY88.jpg,https://m.media-amazon.com/images/I/61TsDxs4PhL._SY88.jpg,,,,,,,Overpriced,https://www.amazon.com/gp/customer-reviews/R1G7VFWP9BR5BV/ref=cm_cr_arp_d_rvw_ttl?ie=UTF8&ASIN=B0BY9625NH,"Reviewed in the United States on May 18, 2023",Delorce FDelorce F,Color: SilverRing Size: 5.5
https://images-na.ssl-images-amazon.com/images/G/01/x-locale/common/grey-pixel.gif,United States,,2023-05-02,TRUE,1,B07YX87JMD,5,Just received it today. I’m obsessed! It’s gorgeous. Can’t stop looking at it. So in love with it. Fits perfectly! ❤️,,,,,,,,,,,OMG,https://www.amazon.com/gp/customer-reviews/R2ADXG0JXNUU1M/ref=cm_cr_arp_d_rvw_ttl?ie=UTF8&ASIN=B07YX7PMFN,"Reviewed in the United States on May 2, 2023",Erica,Ring Size: 3
https://images-na.ssl-images-amazon.com/images/G/01/x-locale/common/grey-pixel.gif,United States,,2020-02-18,TRUE,2,B07YX87JMD,4,The ring is larger than expected so many people call it out as fake but it is pretty and you can easily wear another ring with it it as it sits high enough to allow for a small eternity band to sit with it. Would recommend as long as you are one to take off your rings daily and be gentle with them as this is a large ring and is a bit sharper/ tougher on the edges than I expected as well which I only mention for those who may fall asleep with it on or work with kids.,,,,,,,,,,7 people found this helpful,Larger than expected,https://www.amazon.com/gp/customer-reviews/R2407PNQI6V5ER/ref=cm_cr_arp_d_rvw_ttl?ie=UTF8&ASIN=B07YX7PMFN,"Reviewed in the United States on February 18, 2020",shauno,Ring Size: 5
https://images-na.ssl-images-amazon.com/images/G/01/x-locale/common/grey-pixel.gif,United States,,2022-11-14,FALSE,3,B07YX87JMD,5,"This ring was much bigger than I had anticipated. I'm horrible with measurements so if it says the size, I apologize. I am extremely impressed by the sparkles. I've never seen a ring with a stone that clear. Its gorgeous. Fits perfectly and I can't stop staring at it.",,,,,,,,,,One person found this helpful,Sparkles galore!,https://www.amazon.com/gp/customer-reviews/RKSSXWZ3H5F9D/ref=cm_cr_arp_d_rvw_ttl?ie=UTF8&ASIN=B07YX7PMFN,"Reviewed in the United States on November 14, 2022",Nicki,Ring Size: 9
https://images-na.ssl-images-amazon.com/images/G/01/x-locale/common/grey-pixel.gif,United States,,2023-02-28,TRUE,1,B0BRC7PZ6Y,5,Used it to replace engagement ring.,,,,,,,,,,One person found this helpful,Absolutely gorgeous true to size,https://www.amazon.com/gp/customer-reviews/RREPLGLJ6BOLL?ASIN=B0BRC4ZS36,"Reviewed in the United States on February 28, 2023",Rita Hayes,Size: 5
https://images-na.ssl-images-amazon.com/images/G/01/x-locale/common/grey-pixel.gif,United States,,2023-05-05,FALSE,2,B0BRC7PZ6Y,4,This ring is beautiful don’t get me wrong but I’m disappointed in the fact that it’s stated it’s a White Sapphire and as you can see on the 6th picture I circled the package where it says cubic zirconia which I am not a fan of. So I dont know which it really is but it’s a pretty nice ring. I really like it the setting is beautiful.,https://m.media-amazon.com/images/I/6182196smfL._SY88.jpg,https://m.media-amazon.com/images/I/619MAjr0X4L._SY88.jpg,https://m.media-amazon.com/images/I/61iQqaHHzUL._SY88.jpg,https://m.media-amazon.com/images/I/61uiJSAGM8L._SY88.jpg,https://m.media-amazon.com/images/I/61wp28t1XRL._SY88.jpg,https://m.media-amazon.com/images/I/71SxO+eaFkL._SY88.jpg,,,,,Very pretty but misleading,https://www.amazon.com/gp/customer-reviews/R1SCYFZFSAW6BP?ASIN=B0BRC4ZS36,"Reviewed in the United States on May 5, 2023",deb4nowdeb4now,Size: 6.5
https://images-na.ssl-images-amazon.com/images/G/01/x-locale/common/grey-pixel.gif,United States,,2023-05-03,FALSE,3,B0BRC7PZ6Y,4,"I thought this ring looked very nice based on the photos and decided to get it, it is pretty but you can tell immediately upon inspection that it is very cheap. The main gem looks like glass with shiny foil backing and the ring itself feels like a lightweight low cost metal. This is fine for a piece of shiny jewelry that you won't despair at losing, but nothing to make it seem like you spent any decent amount of money on it.",,,,,,,,,,,Looks its price,https://www.amazon.com/gp/customer-reviews/RJYNPAVLJKNHQ?ASIN=B0BRC4ZS36,"Reviewed in the United States on May 3, 2023",Alicia,Size: 9
https://images-na.ssl-images-amazon.com/images/G/01/x-locale/common/grey-pixel.gif,United States,,2023-04-25,FALSE,4,B0BRC7PZ6Y,4,"This ring was impressive out of the box. One fault is that the lab created diamond is beginning to turn yellow. This could be from the light my wife uses to cure her nails. Now if it turns the correct shade of yellow, it could be a beautiful yellow diamond. If not, the stone or even the entire ring can be replaced very easily. It is an impressive and beautiful ring.",,,,,,,,,,,A BEAUTIFUL RING,https://www.amazon.com/gp/customer-reviews/R24EKGJK0RLYIW?ASIN=B0BRC4ZS36,"Reviewed in the United States on April 25, 2023",STEVEN E.,Size: 8
https://images-na.ssl-images-amazon.com/images/G/01/x-locale/common/grey-pixel.gif,United States,,2023-04-24,FALSE,5,B0BRC7PZ6Y,4,"The ring itself is very pretty, a little on the larger side maybe I should've bought a size 5 instead of 5.5 - which is my true size. It doesn't sparkle like a real diamond but it reflects light in its own way so it looks pretty even from a distance. I am being very careful with this ring so it can last which means I'm not doing dishes or cleaning up the house, so I hope it lasts me a while.",,,,,,,,,,,Very pretty,https://www.amazon.com/gp/customer-reviews/R3DZ15K6A0MO4?ASIN=B0BRC4ZS36,"Reviewed in the United States on April 24, 2023",SweetPea,Size: 5.5
https://images-na.ssl-images-amazon.com/images/G/01/x-locale/common/grey-pixel.gif,United States,,2023-05-21,FALSE,6,B0BRC7PZ6Y,5,"I am in love with this beautiful piece, a work of art. The cut the brilliance of the whole thing is perfection on my finger,I especially love that I can get it in half size too which is a problem for me.",,,,,,,,,,,Brilliant!,https://www.amazon.com/gp/customer-reviews/R2T8UDOVTHDFUJ?ASIN=B0BRC4ZS36,"Reviewed in the United States on May 21, 2023",Frenchsilk,Size: 7.5
https://images-na.ssl-images-amazon.com/images/G/01/x-locale/common/grey-pixel.gif,United States,,2023-05-05,FALSE,7,B0BRC7PZ6Y,5,Got this to wear when I travel so I don’t have to wear my expensive rings and worry about loosing them. This fits the bill and looks great!,,,,,,,,,,,Gorgeous,https://www.amazon.com/gp/customer-reviews/R3NJSN6DK6DL9Q?ASIN=B0BRC4ZS36,"Reviewed in the United States on May 5, 2023",KRMacD,Size: 7
https://images-na.ssl-images-amazon.com/images/G/01/x-locale/common/grey-pixel.gif,United States,,2023-05-09,FALSE,8,B0BRC7PZ6Y,5,"If you want a statement ring, this is it! The stone is huge and it sparkles so much in the light. It fits me as expected and looks so gorgeous. This would be a great backup ring or a ring to wear on vacation if you're afraid of losing your real diamond.",,,,,,,,,,,HUGE!,https://www.amazon.com/gp/customer-reviews/R1ZTTGJMW049JJ?ASIN=B0BRC4ZS36,"Reviewed in the United States on May 9, 2023",Kytia L’amour,Size: 6
https://images-na.ssl-images-amazon.com/images/G/01/x-locale/common/grey-pixel.gif,United States,,2023-05-02,FALSE,9,B0BRC7PZ6Y,5,This ring is really really pretty. Its what you call a 5 table ring--it can be seen 5 tables away. Ive worn it a few times now and people always comment on it. It fits true to size. I love it!,,,,,,,,,,,this is a beautiful ring,https://www.amazon.com/gp/customer-reviews/R2IZZ9APG2252A?ASIN=B0BRC4ZS36,"Reviewed in the United States on May 2, 2023",andrea ziegler,Size: 7
https://images-na.ssl-images-amazon.com/images/G/01/x-locale/common/grey-pixel.gif,United States,,2023-04-21,FALSE,10,B0BRC7PZ6Y,5,"The picture doesn’t do this ring justice. Its a giant. The stone is clear and glistens in the light. The fit is just a teeny bit too big. I would get a half size down in possible. It’s comfortable and looks real. It comes in a beautiful box, also. I can’t wait to wear this and get some reactions. Great costume jewelry as well!",https://m.media-amazon.com/images/I/61siwlw5CDL._SY88.jpg,https://m.media-amazon.com/images/I/71RXWcyxQXL._SY88.jpg,https://m.media-amazon.com/images/I/71RXWcyxQXL._SY88.jpg,,,,,,,,Stunning…..,https://www.amazon.com/gp/customer-reviews/R2RZI67R6O6Y8K?ASIN=B0BRC4ZS36,"Reviewed in the United States on April 21, 2023",Alyssa MorganAlyssa Morgan,Size: 7
https://images-na.ssl-images-amazon.com/images/G/01/x-locale/common/grey-pixel.gif,United States,,2023-05-24,TRUE,1,B07T2DL4KX,3,I love my ring but I did not get it with the certified gemologist certification to confirm this is a ring with natural and conflict-free diamonds and that is very important to me.,,,,,,,,,,,No certified gemologist certification came,https://www.amazon.com/gp/customer-reviews/R5YT7SZO2X6OI/ref=cm_cr_arp_d_rvw_ttl?ie=UTF8&ASIN=B07T1D5MB7,"Reviewed in the United States on May 24, 2023",Remny Duran,Metal Type: Yellow GoldRing Size: 4
https://images-na.ssl-images-amazon.com/images/G/01/x-locale/common/grey-pixel.gif,United States,,2022-10-08,TRUE,2,B07T2DL4KX,4,"I really like the ring, although I did expect it to be a little bigger. It's a little thin and dainty for me, but also of good quality and beauty. Nonetheless, I do like it and I am okay with it because it accentuates my original band well.",,,,,,,,,,One person found this helpful,Fit the Finger,https://www.amazon.com/gp/customer-reviews/R133BSV5RMBR4N/ref=cm_cr_arp_d_rvw_ttl?ie=UTF8&ASIN=B07T1D5MB7,"Reviewed in the United States on October 8, 2022",Lakisha B.,Metal Type: Yellow GoldRing Size: 9.25
https://images-na.ssl-images-amazon.com/images/G/01/x-locale/common/grey-pixel.gif,United States,,2022-08-15,TRUE,3,B07T2DL4KX,5,"I have had this over a month and have not taken it off. It’s been in water, sun, chlorine etc. I’m a nurse and wash my hands frequently and this has held up great! Love it! Exactly what I have been looking for to replace a wedding set as I don’t like to wear my wedding rings to work or anywhere anymore really…great find especially for the price!",,,,,,,,,,2 people found this helpful,"Beautiful, dainty ring!",https://www.amazon.com/gp/customer-reviews/R1VS4VB85IU38E/ref=cm_cr_arp_d_rvw_ttl?ie=UTF8&ASIN=B07T1D5MB7,"Reviewed in the United States on August 15, 2022",Jill,Metal Type: Yellow GoldRing Size: 10.5
https://images-na.ssl-images-amazon.com/images/G/01/x-locale/common/grey-pixel.gif,United States,,2023-01-15,TRUE,4,B07T2DL4KX,5,Fit perfectly. Looks great.,,,,,,,,,,,Really nice ring.,https://www.amazon.com/gp/customer-reviews/R3MJA7WEFBDQN/ref=cm_cr_arp_d_rvw_ttl?ie=UTF8&ASIN=B07T1D5MB7,"Reviewed in the United States on January 15, 2023",Randall McGuire,Metal Type: Rose GoldRing Size: 5.5
https://images-na.ssl-images-amazon.com/images/G/01/x-locale/common/grey-pixel.gif,United States,,2022-02-07,TRUE,5,B07T2DL4KX,4,loved it,,,,,,,,,,,loved,https://www.amazon.com/gp/customer-reviews/R2DK1UM7DCXUXK/ref=cm_cr_arp_d_rvw_ttl?ie=UTF8&ASIN=B07T1D5MB7,"Reviewed in the United States on February 7, 2022",angeljoy,Metal Type: White GoldRing Size: 8.5
https://images-na.ssl-images-amazon.com/images/G/01/x-locale/common/grey-pixel.gif,United States,,2022-04-30,TRUE,6,B07T2DL4KX,5,i was gifted my mother in laws first engagement ring and needed a band to go with it (my wedding band is white gold). This band is the perfect accent to to enhance the beauty of the other ring. Exactly what i was looking for.,https://m.media-amazon.com/images/I/61N6CKqgS+L._SY88.jpg,,,,,,,,,,perfect accent,https://www.amazon.com/gp/customer-reviews/R14UA6J3W3ZUI5/ref=cm_cr_arp_d_rvw_ttl?ie=UTF8&ASIN=B07T1D5MB7,"Reviewed in the United States on April 30, 2022",Carolyn GrusseCarolyn Grusse,Metal Type: Yellow GoldRing Size: 6.5
https://images-na.ssl-images-amazon.com/images/G/01/x-locale/common/grey-pixel.gif,United States,,2020-10-20,TRUE,7,B07T2DL4KX,5,The fit is great! True to size! Dainty and elegant! I love it so much!! So far its very tough and I wear it to shower no problem! 2 or 3 months and ring looks the same as I got it when I first put it on. My original engagement rings prongs broke and the band wouldn't work with any other ring. So this band is very versatile and keeps attention to the engagement ring! I love it,https://images-na.ssl-images-amazon.com/images/I/710kt8Iy7iL._SY88.jpg,https://images-na.ssl-images-amazon.com/images/I/71f0ckMksOL._SY88.jpg,https://images-na.ssl-images-amazon.com/images/I/71mHWPiocWL._SY88.jpg,,,,,,,4 people found this helpful,Elegant and doesn't offset the engagement ring!,https://www.amazon.com/gp/customer-reviews/R3K24UQCD1XFTY/ref=cm_cr_arp_d_rvw_ttl?ie=UTF8&ASIN=B07T1D5MB7,"Reviewed in the United States on October 20, 2020",Nadia C Smith / Ikromjon UsmonkulovNadia C Smith / Ikromjon Usmonkulov,Metal Type: white-goldRing Size: 4.5
https://images-na.ssl-images-amazon.com/images/G/01/x-locale/common/grey-pixel.gif,United States,,2021-08-28,TRUE,8,B07T2DL4KX,5,"This is a beautiful ring at a great price! Unfortunately, I had to return it because my solitaire sticks out too far and left a gap between the rings that just did not look right to me. Such a bummer!",https://m.media-amazon.com/images/I/B1jyalNGOkS._SY88.jpg,https://m.media-amazon.com/images/I/B1qWi-Ckc-S._SY88.jpg,,,,,,,,One person found this helpful,Beautiful,https://www.amazon.com/gp/customer-reviews/R1CJWC3AOYRVSL/ref=cm_cr_arp_d_rvw_ttl?ie=UTF8&ASIN=B07T1D5MB7,"Reviewed in the United States on August 28, 2021",Regan JohnsonRegan Johnson,Metal Type: White GoldRing Size: 5.5
https://images-na.ssl-images-amazon.com/images/G/01/x-locale/common/grey-pixel.gif,United States,,2022-04-07,TRUE,9,B07T2DL4KX,5,Comes with paperwork! Addition to my wedding ring to give it some sparkle. I love it.,,,,,,,,,,3 people found this helpful,Beautiful ring.,https://www.amazon.com/gp/customer-reviews/R13X69PMI3XFAP/ref=cm_cr_arp_d_rvw_ttl?ie=UTF8&ASIN=B07T1D5MB7,"Reviewed in the United States on April 7, 2022",ShyraD,Metal Type: Yellow GoldRing Size: 7.5
https://images-na.ssl-images-amazon.com/images/G/01/x-locale/common/grey-pixel.gif,United States,,2021-03-05,TRUE,10,B07T2DL4KX,4,Stackable for more expensive emerald and diamond ring. Goes well together.,,,,,,,,,,,Dainty and pretty. Sun will catch the ring and it’s very sparkly.,https://www.amazon.com/gp/customer-reviews/R22LO8IGY6ELCD/ref=cm_cr_arp_d_rvw_ttl?ie=UTF8&ASIN=B07T1D5MB7,"Reviewed in the United States on March 5, 2021",susan a. brownlee,Metal Type: White GoldRing Size: 8
https://images-na.ssl-images-amazon.com/images/G/01/x-locale/common/grey-pixel.gif,United States,,2021-04-22,TRUE,1,B07L2TFLGT,5,"This little ring sparkles like crazy. This is a size 6 for reference. I think I may need to return it because for me personally, I feel it looks more appropriate for a young woman or as an engagement ring, rather than the 40 something, right hand ring I'm searching for. It's just a bit too ""birthstone ring"" for what I'm envisioning. But it is lovely and comfortable so I'm still giving it 5 stars. I received it yesterday so I can't speak to endurance. Hope that all helps :)",https://images-na.ssl-images-amazon.com/images/I/918b+7CFhOL._SY88.jpg,https://images-na.ssl-images-amazon.com/images/I/91DGs4X3CbL._SY88.jpg,https://images-na.ssl-images-amazon.com/images/I/91IjQ3CXedL._SY88.jpg,https://images-na.ssl-images-amazon.com/images/I/91hmS-BtZEL._SY88.jpg,https://images-na.ssl-images-amazon.com/images/I/91xBMmPBDaL._SY88.jpg,,,,,,Dainty with crazy sparkle,https://www.amazon.com/gp/customer-reviews/RS6JTOEHYB2X9/ref=cm_cr_arp_d_rvw_ttl?ie=UTF8&ASIN=B09FYGLPYF,"Reviewed in the United States on April 22, 2021",Msfirefly Msfirefly,Ring Size: 6
